{
  "$schema": "https://json-schema.org/draft/2020-12/schema",
  "title": "Atlas search criteria, version 1",
  "type": "object",
  "required": ["version", "criteria"],
  "additionalProperties": false,
  "properties": {
    "version": {"const": 1},
    "query": {"type": "string"},
    "criteria": {"type": "array", "items": {"$ref": "#/$defs/criterion"}},
    "display": {"type": "array", "items": {"type": "string"}}
  },
  "$defs": {
    "criterion": {
      "type": "object",
      "required": ["id", "statement", "check"],
      "additionalProperties": false,
      "properties": {
        "id": {"type": "string", "pattern": "^[a-z0-9-]+$"},
        "statement": {"type": "string"},
        "must": {"type": "boolean"},
        "weight": {"type": "integer", "minimum": 1},
        "check": {"$ref": "#/$defs/condition"},
        "partial": {"$ref": "#/$defs/condition"},
        "when": {"$ref": "#/$defs/condition"}
      }
    },
    "condition": {
      "oneOf": [
        {
          "type": "object",
          "required": ["field", "op", "value"],
          "additionalProperties": false,
          "properties": {
            "field": {"type": "string"},
            "op": {"enum": ["==", "in", "contains_any", ">=", "<=", "overlaps"]},
            "value": {}
          }
        },
        {
          "type": "object",
          "required": ["any"],
          "additionalProperties": false,
          "properties": {"any": {"type": "array", "minItems": 1, "items": {"$ref": "#/$defs/condition"}}}
        },
        {
          "type": "object",
          "required": ["all"],
          "additionalProperties": false,
          "properties": {"all": {"type": "array", "minItems": 1, "items": {"$ref": "#/$defs/condition"}}}
        }
      ]
    }
  }
}
